{
  "schemaVersion": 1,
  "family": "B",
  "familyName": "skills",
  "generator": "scripts/render-reference.mjs",
  "members": [
    {
      "name": "ai-doc",
      "kind": "skill",
      "shipsTo": {
        "tier": "core",
        "stacks": [
          "react-native",
          "react-next",
          "react-spa",
          "ts-server"
        ]
      },
      "description": "Use when creating or fixing an AI-facing doc/rule/skill/agent in this repo (SKILL.md, .claude/rules/*, agents/*, CLAUDE.md, AGENTS.md) — to apply the project's context-hygiene + rule-as-test + AI-agnostic authoring standard. Triggers: write a rule, author a skill, fix a doc, doc-authority header, progressive disclosure, channel selection, документация, правило, скилл.",
      "source": {
        "path": ".agents/procedures/ai-doc/SKILL.md",
        "line": 3
      },
      "extras": {
        "invocation": "auto",
        "posture": "portable",
        "operator-twin": ".claude/skills/ai-doc/SKILL.md"
      },
      "example": null
    },
    {
      "name": "aif-doctor",
      "kind": "skill",
      "shipsTo": {
        "tier": "factory",
        "absent": "no-lane"
      },
      "description": "Use when the aif-handoff runtime is misbehaving — a task is stuck or crash-looping, new tasks stay backlog at capacity, the claude runtime is broken. Triggers: aif-doctor, aif health, task stuck, задача висит, runtime broken, рантайм сломан, aif не отвечает, capacity skipping, native binary not installed, why won't my task start. Invokable when the dispatcher is NOT running. NOT for running the dispatch loop (/dispatcher) or planning (/pipeline).",
      "source": {
        "path": ".agents/procedures/aif-doctor/SKILL.md",
        "line": 3
      },
      "extras": {
        "invocation": "slash-only",
        "posture": "cc-only",
        "operator-twin": ".claude/skills/aif-doctor/SKILL.md"
      },
      "example": null
    },
    {
      "name": "arch",
      "kind": "skill",
      "shipsTo": {
        "tier": "env",
        "stacks": [
          "react-native",
          "react-next",
          "react-spa",
          "ts-server"
        ]
      },
      "description": "Use when starting the EXTERNAL design contour — turning a raw idea or prep-doc into a reviewed design and a routed handoff. Triggers: /arch, external contour, внешний контур, спроектируй идею, задумка в архитектуру, design contour, arch loop, продумай и спроектируй, идея → kickoff, research contour, research-spec, distillate, исследовательский контур. NOT for reviewing code (/reviewer), dispatching stages (/pipeline), factory runtime questions (aif-doctor), or a bare brainstorm with no handoff (superpowers:brainstorming).",
      "source": {
        "path": ".agents/procedures/arch/SKILL.md",
        "line": 3
      },
      "extras": {
        "invocation": "slash-only",
        "posture": "cc-native-with-fallback",
        "operator-twin": ".claude/skills/arch/SKILL.md"
      },
      "example": null
    },
    {
      "name": "claude-glm-executor-handoff",
      "kind": "skill",
      "shipsTo": {
        "tier": "factory",
        "absent": "no-lane"
      },
      "description": "Use when an in-aif Claude coordinator is about to dispatch an executable task to a GLM-5.3 worker (any agent whose frontmatter carries `model: glm-5.3` or a GLM-family model). Triggers: writing a dispatch prompt for a GLM worker inside aif-handoff, GLM executor, implement-worker GLM, cross-model dispatch within aif, planning a handoff to GLM-5.3, parsing a GLM worker's REPORT. NOT for Claude→Claude worker dispatch (use SDD directly).",
      "source": {
        "path": ".agents/procedures/claude-glm-executor-handoff/SKILL.md",
        "line": 3
      },
      "extras": {
        "invocation": "auto",
        "posture": "cc-only",
        "operator-twin": ".claude/skills/claude-glm-executor-handoff/SKILL.md"
      },
      "example": null
    },
    {
      "name": "dispatcher",
      "kind": "skill",
      "shipsTo": {
        "tier": "factory",
        "absent": "no-lane"
      },
      "description": "Use when you need to EXECUTE a chosen umbrella's stages through the aif-control loop. Triggers: dispatcher, execute umbrella, run stages, aif loop, harvest PR, stage gate advance. Invocation channel: explicit /dispatcher only — disable-model-invocation:true is a channel flag and not a permission (§0). NOT for planning — priority and launch-table are /pipeline.",
      "source": {
        "path": ".agents/procedures/dispatcher/SKILL.md",
        "line": 3
      },
      "extras": {
        "invocation": "slash-only",
        "posture": "cc-native-with-fallback",
        "operator-twin": ".claude/skills/dispatcher/SKILL.md"
      },
      "example": null
    },
    {
      "name": "docs-author",
      "kind": "skill",
      "shipsTo": {
        "tier": "framework",
        "absent": "no-lane"
      },
      "description": "Use when writing or editing any getff.ai docs page under docs/site/ (including the glossary terms.md), when picking a page kind or filling the reader-comfort card, or when running a docs refresh over touched pages — to apply the kind registry, the craft contract, and the docs-check done-checklist. Triggers: write a docs page, new page under docs/site, glossary entry, terms.md, docs refresh, gold page, Diátaxis, задокументировать, страница документации.",
      "source": {
        "path": ".agents/procedures/docs-author/SKILL.md",
        "line": 3
      },
      "extras": {
        "invocation": "auto",
        "posture": "portable",
        "operator-twin": ".claude/skills/docs-author/SKILL.md"
      },
      "example": null
    },
    {
      "name": "getff",
      "kind": "skill",
      "shipsTo": {
        "tier": "framework",
        "stacks": [
          "cargo",
          "go",
          "python",
          "react-native",
          "react-next",
          "react-spa",
          "ts-server"
        ]
      },
      "description": "Use when treating any codebase rule (architectural, naming, dependency, test-quality, contract, SLO) as an executable test that fails the build when violated, or when the user asks about enforcing code quality, fighting AI-generated code drift, setting up linters/tests/CI/pre-commit hooks, designing review processes, mutation testing, contract testing, fitness functions, observability-driven development, SLO-as-code, or \"how do I make my codebase resistant to AI agents breaking my conventions\". Also trigger on ArchUnit, Stryker, Pact, dependency-cruiser, AI Factory (aif), Husky, lint-staged, ESLint flat config, Zod validation strategy, or shift-left/shift-right testing. Strongly trigger when the user mentions Claude Code, Cursor, or Copilot writing code that \"looks fine but is wrong\".",
      "source": {
        "path": ".agents/procedures/getff/SKILL.md",
        "line": 3
      },
      "extras": {
        "invocation": "auto",
        "posture": "portable",
        "operator-twin": {
          "absent": "no-operator-twin"
        }
      },
      "example": null
    },
    {
      "name": "getff-experience",
      "kind": "skill",
      "shipsTo": {
        "tier": "framework",
        "absent": "no-lane"
      },
      "description": "Use when beginning substantive implementation, debugging, integration, or design work in the getff repository and about to choose an approach — before writing code, fixing an unfamiliar failure, or committing to a plan. Triggers: starting a feature, bugfix, gate/CI/hook/renderer/tooling change in getff; a distinctive build, test, or runtime error. Not for trivial edits, mechanical continuation of in-flight work, or when the current task already supplies the needed prior solution.",
      "source": {
        "path": ".agents/procedures/getff-experience/SKILL.md",
        "line": 3
      },
      "extras": {
        "invocation": "auto",
        "posture": "portable",
        "operator-twin": ".claude/skills/getff-experience/SKILL.md"
      },
      "example": null
    },
    {
      "name": "harvest",
      "kind": "skill",
      "shipsTo": {
        "tier": "factory",
        "stacks": [
          "react-native",
          "react-next",
          "react-spa",
          "ts-server"
        ]
      },
      "description": "Use when harvesting a finished aif-agent branch into a PR after acceptance. Triggers: harvest, harvest aif branch, egress aif task, push harvested work, post-acceptance harvest. Invocation channel: explicit /harvest only — disable-model-invocation:true is a channel flag and not a permission (§0).",
      "source": {
        "path": ".agents/procedures/harvest/SKILL.md",
        "line": 3
      },
      "extras": {
        "invocation": "slash-only",
        "posture": "portable",
        "operator-twin": ".claude/skills/harvest/SKILL.md"
      },
      "example": null
    },
    {
      "name": "installing-enforcement",
      "kind": "skill",
      "shipsTo": {
        "tier": "framework",
        "absent": "no-lane"
      },
      "description": "Use when the user wants to actually WIRE the hard enforcement layer (git pre-commit/pre-push hooks + CI) into their repo, or asks \"how do I make these rules actually fail the build / block a commit / run in CI\", or wants to turn the rules-as-tests methodology from advice into a build-failing gate. Explains the soft-vs-hard boundary and points at the /getff:install-enforcement command.",
      "source": {
        "path": ".agents/procedures/installing-enforcement/SKILL.md",
        "line": 3
      },
      "extras": {
        "invocation": "auto",
        "posture": "cc-native-with-fallback",
        "operator-twin": {
          "absent": "no-operator-twin"
        }
      },
      "example": null
    },
    {
      "name": "intent",
      "kind": "skill",
      "shipsTo": {
        "tier": "factory",
        "absent": "no-lane"
      },